<?xml version="1.0" encoding="UTF-8"?>
<xs:schema
    xmlns:xs="http://www.w3.org/2001/XMLSchema"
    targetNamespace="http://itpu.uz/employee-ns"
    elementFormDefault="qualified">

    <xs:element name="employees">
        <xs:complexType>
            <xs:sequence>
                <xs:element name="employee" maxOccurs="unbounded">
                    <xs:complexType>
                        <xs:sequence>
                            <xs:element name="firstName" type="xs:string"/>
                            <xs:element name="lastName" type="xs:string"/>
                            <xs:element name="active" type="xs:boolean"/>
                            <xs:element name="salary" type="xs:decimal"/>
                            <xs:element name="department" type="xs:string"/>
                            <xs:element name="skills">
                                <xs:complexType>
                                    <xs:sequence>
                                        <xs:element name="skill" type="xs:string" minOccurs="1" maxOccurs="unbounded"/>
                                    </xs:sequence>
                                </xs:complexType>
                            </xs:element>
                            <xs:element name="address">
                                <xs:complexType>
                                    <xs:sequence>
                                        <xs:element name="city" type="xs:string"/>
                                        <xs:element name="country" type="xs:string"/>
                                        <xs:element name="zipCode" type="xs:string"/>
                                    </xs:sequence>
                                </xs:complexType>
                            </xs:element>
                        </xs:sequence>
                        <xs:attribute name="id" type="xs:integer" use="required"/>
                    </xs:complexType>
                </xs:element>
            </xs:sequence>
        </xs:complexType>
    </xs:element>
</xs:schema>

